src_ctx	src	trg
From 1982 to 1988, Muldashev worked as an ophthalmologist in the eye department of Hospital No.10, MSCh OLUNPZ. From 1990, he was а director of the All-Russian Center for Ophthalmic and Plastic Surgery (Ufa).	From 1988 to 1990, [pr] held the position of head of the transplant laboratory for ophthalmosurgery of MNTK "Eye Microsurgery".	Von 1988 bis 1990 hatte er die Position des Leiters des Transplantationslabors für Ophthalmochirurgie des MNTK „Augen-Mikrochirurgie“ inne.
Wiesner and Gmeyner separated in 1928. During 1926 while Wiesner was still in Austria, he began investigating the role of hormones in regulating fertility and their impact on fetal development.	[pr] became a naturalized citizen in 1934.	Er wurde 1934 eingebürgert.
In 1953, she enrolled at Columbia University, graduating with a BS in marine biology in 1956. After completion of her schooling, Bonnelly began her first job at the New York Aquarium as a research assistant to Ross Nigrelli.	[pr] went on to attain a master's degree from New York University in 1961.	Anschließend erhielt sie 1961 einen Masterabschluss von der New York University.
She is a facial nerve expert who treats facial paralysis and focuses her scientific research in all methods to rejuvenate the face and neck. Shurgaya graduated from Tbilisi State Medical University in 1981.	[pr] is one of the pioneers of facial rejuvenation in Russia and has devoted [pr] life to studying the human face and all surgical and non-surgical methods to keep it looking younger and fight the onset of aging.	Sie ist gehört zu den Pionieren der Gesichtsverjüngung in Russland und hat ihr Leben dem Studium des menschlichen Gesichts sowie sämtlicher chirurgischer und nichtchirurgischer Methoden, mit denen sich dessen jüngeres Aussehen bewahren und dem Beginn der Alterung entgegentreten lässt, verschrieben.
Stephen Bruce Bromhead (born c. 1957), an Australian politician, is a member of the New South Wales Legislative Assembly, having represented Myall Lakes for the Nationals since 26 March 2011. He later joined the New South Wales Police Force, serving initially as a general duties officer and then as a detective; serving for a total of 12 years in the majority around Taree and surrounding districts.	Bromhead is a registered nurse with two certificates, commencing work initially as a nurse.	Bromhead ist examinierter Krankenpfleger mit zwei Zertifikaten, der ursprünglich die Arbeit als Krankenpfleger aufgenommen hatte.
After a couple of years she started suturing and then moved on to undertake surgery. The work of Reginald and Catherine Hamlin, and Mamitu Gashe, was recognised by the Royal College of Surgeons of England (RCS) with the award of its Gold Medal.	Hamlin trained [pr] in how to repair fistulas, and [pr] is now regarded as one of the institution's leading fistula surgeons, often training new post-graduate doctors.	Hamlin schulte sie im Reparieren von Geburtsfisteln, und heute gilt sie als eine der führenden Chirurginnen für Fisteln der Einrichtung, die häufig neue Ärzte im Aufbaustudium ausbildet.
The Mahotella Queens is a South African female band formed in 1964 by music producer Rupert Bopape consisting of Hilda Tloubatla, Nobesuthu Mbadu, and Amanda Nkosi.  Bopape was a talent scout and producer at the independent Gallo Africa's subsidiary dedicated to black music, Mavuthela Music Company.	The group is noted for their distinct vocal harmony sound, guitar-led mbaqanga music, and fast stage dancing.	Die Gruppe ist für ihren unverkennbaren stimmlichen Harmonieklang, Mbaqanga-Gitarrenmusik und schnelle Bühnentänze bekannt.
She is currently the CEO of Shell Refining Company in Malaysia. She became Vice President of the Malaysian Bank of America and head of its marketing division.	[pr] started working for Bank of America in the 1970s.	Sie begann in den 1970ern, für die Bank of America zu arbeiten.
Yang's career has been characterized by a desire to improve literacy skills among underprivileged and overlooked individuals in society. Angela Yang grew up in Taiwan with her twice-refugee family.	[pr] established a successful adult literacy program and introduced library services to a wider population that included the elderly and disabled communities.	Sie rief ein erfolgreiches Lese- und Schreibprogramm für Erwachsene ins Leben und stellte Bibliotheksleistungen einer breiteren Bevölkerungsschicht vor, einschließlich älteren und behinderten Menschen.
He was Resident Choreographer at Sadler's Wells, London, where he established the Mark Baldwin Dance Company (1993–2001). He was Resident Choreographer for Scottish Ballet in 1996.	[pr] created over 40 works for [pr] new company and other major dance companies including: The Royal Ballet, Royal New Zealand Ballet, Berlin State Opera House, Phoenix Dance Theatre, Scottish Ballet, London City Ballet and Rambert Dance Company.	Er schuf über 40 Werke für sein neues Ensemble und andere große Tanzensembles wie z. B.: The Royal Ballet, Royal New Zealand Ballet, Staatsoper Berlin, Phoenix Dance Theatre, Scottish Ballet, London City Ballet und Rambert Dance Company.
Her future husband proposed to her after recognizing her talents and allowing her to lead the small nursing department. Bilquis Bano Edhi HI (Urdu: بلقیس ایدھی‎), widow of Abdul Sattar Edhi, is a professional nurse and one of the most active philanthropists in Pakistan along with serving as co-chair of Edhi Foundation.	[pr] had recognized [pr] enthusiasm and interest during [pr] six-month training program where [pr] had learnt basic midwifery and healthcare.	Er hatte ihren Enthusiasmus und ihr Interesse während ihres sechsmonatigen Ausbildungsprogramms erkannt, in dem sie die Grundlagen der Geburtshilfe und Pflege gelernt hatte.
She drove for the establishment of the Bahamas Nursing Council, a governing body for the country's nursing industry and was influential in developing a degree based nursing certification. Hilda Valeria Barnice Bowen was born on 12 October 1923 in Nassau, Bahamas to Jestina (née Johnson) and Irvin Bowen.	[pr] was honored as a Member of the Order of the British Empire in 1969 for [pr] contributions to the medical development of the country.	Sie wurde 1969 für ihren Beitrag zur medizinischen Entwicklung des Landes als Member des Order of the British Empire geehrt.
She worked previously as a businesswoman, accountant, and bank executive. In this role, she supervised business development in Cameroon, the Democratic Republic of the Congo, Ghana, Kenya, Liberia, Mozambique, Tanzania, Uganda, and Zambia.	[pr] was the director for business development in Anglophone Africa at the United Bank for Africa at the bank's headquarters in Lagos, Nigeria.	Sie war Direktorin für die Geschäftsentwicklung im anglofonen Afrika bei der United Bank for Africa am Hauptstandort der Bank in Lagos, Nigeria.
Her first major role as an actress was in the play titled: All My Sons by Arthur Miller, directed by Akbar Zanjanpour. She played a leading role in Hadi Marzban's production of Memoirs of the Actor in a Supporting Role.	[pr] supported actors and actresses such as Khosrow Shakibayee, Hady Marzban and Soraya Ghasemi in that play.	In dem Stück hatte sie eine Nebenrolle neben Schauspielern und Schauspielerinnen wie Khosro Shakibai, Hadi Marzban und Soraya Ghasemi.
Idelisa Bonnelly de Calventi (born 10 September 1931) is a Dominican marine biologist who is considered the "mother of marine conservation in the Caribbean". She was instrumental in the creation of the first Humpback Whale Sanctuary of the North Atlantic and has won numerous awards, including induction into the UNEP's Global 500 Roll of Honour, Unesco's Marie Curie Medal and the Order of Merit of Duarte, Sánchez and Mella.	[pr] was the founder of the study of biology in the Dominican Republic, as well as the founder of the Institute of Marine Biology and the Dominican Foundation for Marine Research.	Sie war die Gründerin des Studienbereichs Biologie in der Dominikanischen Republik sowie Gründerin des Instituts für Meeresbiologie und der Dominican Foundation for Marine Research.
In addition, she has worked with Reiner Körfer \[de] in Bad Oeynhausen, Essen and Duisburg to develop a new type of artificial heart without wires and external power sources. Dilek Gürsoy (born 1976) is a Turkish-German heart surgeon.	In 2017, [pr] worked in Bremen.	2017 hat sie in Bremen gearbeitet.
He continued his studies at the University of Sciences of Paris XI Orsay. He also received a PhD in molecular pharmacology in 1987.	There [pr] completed a postgraduate diploma in electrophysiology and cardiovascular pharmacology.	Dort schloss er ein postgraduales Diplom in Elektrophysiologie und kardiovaskulärer Pharmakologie ab.
Yap started Powerlifting in 2012 and competed in his first local competition in 2014. This was the start of his medal haul which also sparked his passion for coaching and to eventually to being the Founder of his coaching company, CoachbyMARC, leading a team of athletes to victory in various international competitions.	[pr] made [pr] international debut at the end of 2014 and won the Asia & Oceania Championship title.	Er gab seinen internationalen Einstand Ende 2014 und gewann den Titel bei den Asien-Ozeanien-Meisterschaften.
She was a member of the Editorial Board of ‘Scientific Reports’ of Nature Publishing Group, London:‘Spermatogenesis’, Landes Bioscience, Texas and Editorial Board member of ‘Molecular and Cellular Endocrinology’ of Elsevier, PA, Austin. She is the former Director of the Institute.	Chandrima Shaha (born 14 October 1952)  is an Indian biologist, currently President of Indian National Science Academy (2020-22), and Professor of Eminence at the National Institute of Immunology.	Chandrima Shaha (geboren am 14. Oktober 1952) ist eine indische Biologin, derzeit Präsidentin der Indian National Science Academy (2020–22) und Professor of Eminence am National Institute of Immunology.
On the political front, she started several branches of All-India Women's Conference. Indian National Council for Women held its biennial conference in Cuttack, under her leadership.	[pr] established Orissa Nari Seba Sangha in 1941 for social welfare of women.	1941 gründete sie die Organisation Orissa Nari Seba Sangha, die sich für das soziale Wohlergehen von Frauen einsetzt.
He participated in the review of the Children, Young Persons, and Their Families Act 1989, led work on the prevention of child abuse for the Taskforce on Action on Violence within Families, and, in 2003 to 2004, served on the ministerial task force on the community and voluntary sector. In 2009 he voiced his support for the Crimes (Substituted Section 59) Amendment Act 2007 (the so-called "anti-smacking" law) in advance of the citizens-initiated referendum later that year, aimed at repealing the act.	In 2009, [pr] succeeded Cindy Kiro as the Children's Commissioner, a role in which [pr] served until June 2011.	2009 wurde er Nachfolger von Cindy Kiro als Kinderbeauftragter, eine Rolle, die er bis Juni 2011 innehatte.
She was born in Northern Rhodesia on 1 November 1961. She is also a Chartered Certified Accountant, recognized by the Association of Chartered Certified Accountants of London.	[pr] holds a Bachelor of Business Administration degree.	Sie hat einen Abschluss als Bachelor of Business Administration.
Rachel Mary Parsons (1885–1956), engineer and advocate for women's employment rights, was the founding President of the Women's Engineering Society in Britain on 23 June 1919. Her brother, Algernon George (Tommy) (b.1886), was killed on 28 April 1918 while a Major in the Royal Field Artillery.	Rachel Mary Parsons was born in 1885, to Sir Charles Algernon Parsons and [pr] wife Katharine (d.1933), the daughter of William Froggatt Bethell of Rise Park, East Riding of Yorkshire.	Rachel Mary Parsons wurde 1885 als Tochter von Sir Charles Algernon Parsons und seiner Ehefrau Katharine (gest. 1933), Tochter von William Froggatt Bethell aus Rise Park, East Riding of Yorkshire, geboren.
She was schooled in Martin-Luther-Grundschule for primary i, and then completed the high school at Quirinus-Gymnasium in Neuss. Her future professional career has been always surgery since her childhood.	[pr] was the first in [pr] family to go to university, where [pr] focused on cardiovascular surgery.	Sie war das erste Mitglied ihrer Familie, das an die Universität ging, wo sie ihren Schwerpunkt auf kardiovaskuläre Chirurgie legte.
In fall 2010 she was senior research fellow of the International Centre for Cultural Studies (IFK) in Vienna (Austria). Her 2013 book entitled "Cleaning as Passion" (German orig. Putzen als Passion) became a biology bestseller in Germany.	[pr] returned to Germany in summer 2010 to become Department Chair of the Philosophy Department at Technische Universität Braunschweig.	Sie kehrte im Sommer 2010 nach Deutschland zurück, um Fachbereichsleiterin des Seminars für Philosophie an der Technischen Universität Braunschweig zu werden.
She was placed in a biology program as an undergraduate due to her high test scores. She did her Ph.D. work in the United States at Colorado State University, graduating in 2005, working on migration of embryonic and metastatic cells under James Bamburg.	For [pr] master's degree [pr] specialized in developmental and reproductive biology under Hameed Al Haj.	Für ihren Masterabschluss spezialisierte sie sich unter Hameed al Haj auf Entwicklungs- und Fortpflanzungsbiologie.
She was the first woman in Malaysia to be the Chief Executive Officer of a bank. She is currently the CEO of Shell Refining Company in Malaysia.	[pr] was the CEO of Hong Leong Bank.	Sie war CEO der Hong Leong Bank.
In 1983 he also completed his compulsory military service. Elo joined the Swedish Cullberg Ballet 1984 for six years.	In 1980 [pr] attended Varna International Ballet Competition and 1984 [pr] was a finalist in Helsinki International Ballet Competition.	1980 nahm er am International Ballet Competition in Varna teil und 1984 war er Finalist der International Ballet Competition in Helsinki.
Thanks to the methodology she developed for reconstructing extinct dances, she and her husband revived over 20 folk dances from the colonial period, most of which had been completely forgotten. In 1975, after Margaret Graham (1931–2004) had founded the National Dance School (Escuela Nacional de Danza), Rodríguez became a co-founder of its Folklore Department where she taught dance theory and history of dance while giving practical training in ballet and dance.	[pr] became one of the most important researchers in the area, writing several books on the subject.	Sie wurde zu einer der wichtigsten Forscherinnen auf diesem Gebiet und schrieb zu dem Thema mehrere Bücher.
Lewis graduated from the University of Kansas, in Lawrence, Kansas, in 1960, where he was a classmate of Wilt Chamberlain. He worked full-time at the Menninger Clinic while attending law school.	[pr] earned a law degree from the Washburn University School of Law, in Topeka, Kansas, in 1963.	Er erwarb 1963 einen Abschluss in Jura an der Washburn University School of Law in Topeka, Kansas.
His passion was dancing, but he could not afford dance lessons. In 1999, Pérez moved to Miami, Florida "in search of the American Dream".	After [pr] won a national lambada contest in Colombia, [pr] was accepted to one of Cali's best academies to study dance while [pr] taught step aerobics in return.	Nachdem er einen nationalen Lambada-Wettbewerb in Kolumbien gewonnen hatte, wurde er an einer der besten Akademien in Cali aufgenommen, um Tanz zu studieren, während er als Gegenleistung Step Aerobic unterrichtete.
His work over the last 20 years has focused on dialogue process design and implementation, conflict resolution, conflict early warning, stabilisation, as well as forecasting and strategy. His tenure as Director involved the establishment of early warning systems in the North Caucasus, West Africa, and Great Lakes region.	After several years in the humanitarian and public health fields, [pr] was recruited in 1997 to establish the Forum on Early Warning and Early Response (FEWER).	Nach mehrjähriger Tätigkeit in den Bereichen humanitäre Hilfe und öffentliche Gesundheit wurde er 1997 ausgewählt, um das Forum on Early Warning and Early Response (FEWER) aufzubauen.
Initially an a cappella group, guitarist Polycarp Otieno joined before they named themselves Sauti. Their second studio album, Sol Filosofia, was released on 25 February 2011, earning the group a number of accolades and nominations in the process.	Sauti Sol released their debut studio album Mwanzo on 1 November 2008, to critical acclaim.	Sauti Sol veröffentlichte sein Debütalbum Mwanzo am 1. November 2008, das von Kritikern hochgelobt wurde.
At the 2001 World Junior Championships, he won the gold on the 3m Springboard and the silver medal on the Platform. At the 2006 World Cup, he won the gold on the 3m springboard.	At the 2006 National Championships, [pr] won the silver medal on the springboard.	Bei den nationalen Meisterschaften 2006 gewann er vom Brett die Silbermedaille.
In 1948, her family sent her to study at St. Josephs's Convent in Kalimpong, India. In 1953, she went to Allahabad, India and enrolled at Kamla Nehru Memorial Hospital to pursue her long cherished goal to become a nurse.	Returning to Kathmandu, [pr] joined Kanya High School and finished 10th grade.	Nach ihrer Rückkehr nach Kathmandu ging sie an die Kanya High School und schloss die 10. Klasse ab.
She won the Hamburg Marathon in 2013 and the Mexico City Marathon in 2016. The following year she placed sixth in the 5000 metres at the 1999 European Athletics Junior Championships held in Riga.	Lobačevskė started out as a track runner and in 1998 [pr] represented [pr] country in the 3000 metres at the 1998 World Junior Championships in Athletics.	Lobačevskė begann als Läuferin in der Leichtathletik und vertrat ihr Land 1998 bei den Leichtathletik-Juniorenweltmeisterschaften 1998 über die 3000 Meter.
She is a member of the Nigerian Library Association (NLA) and a two-time Vice Chairman of Nigeria Library Association, Information Technology (NLAIT) Section. Ezeani has edited two Library and Information Science books and also co-authored a book in Science Education.	[pr] is also a current Council member of the NLA.	Sie ist zudem ein aktuelles Beiratsmitglied der NLA.
She was also the first woman CEO in all of Barclays Bank's African subsidiaries at the time. She worked previously as a businesswoman, accountant, and bank executive.	Margaret Mhango Mwanakatwe is a Zambian politician who was the Minister of Finance from 14 February 2018 to 14 July 2019.	Margaret Mhango Mwanakatwe ist eine sambische Politikerin, die vom 14. Februar 2018 bis zum 14. Juli 2019 Finanzministerin war.
Following his internship, Omaswa worked as a medical officer from 1970 until September 1974, when he left for further studies in the United Kingdom. Francis Gervase Omaswa, MBChB, MMed, FRCS (Edin), FCS (ECSA), is a Ugandan cardiovascular surgeon, academic and administrator.	[pr] trained as a cardiothoracic surgeon.	Er machte eine Ausbildung zum Herz-Lungen-Chirurgen.
In 1910 she entered Newnham College at the University of Cambridge and was one of the first three women to study Mechanical Sciences there although, like all women until 1948, she could not graduate with a degree or become a full member of the University. Rachel Mary Parsons was born in 1885, to Sir Charles Algernon Parsons and his wife Katharine (d.1933), the daughter of William Froggatt Bethell of Rise Park, East Riding of Yorkshire.	Rachel Mary Parsons (1885–1956), engineer and advocate for women's employment rights, was the founding President of the Women's Engineering Society in Britain on 23 June 1919.	Rachel Mary Parsons (1885–1956), Ingenieurin und Fürsprecherin der Arbeitsrechte für Frauen, war die Gründungspräsidentin der Women’s Engineering Society in Großbritannien am 23. Juni 1919.
After graduation from University of Düsseldorf, she worked as assistant physician, specialist and assistant medical director. In 2017, she worked in Bremen.	In addition, [pr] has worked with Reiner Körfer \[de] in Bad Oeynhausen, Essen and Duisburg to develop a new type of artificial heart without wires and external power sources.	Darüber hinaus hat sie in Bad Oeynhausen, Essen und Duisburg mit Reiner Körfer \[de] zusammengearbeitet, um einen neuen Typ von künstlichem Herz ohne Kabel und externe Energiequellen zu entwickeln.
During her time in Fiji she was part of the Fiji table tennis team that won gold at the 1963 South Pacific Games. Otobed graduated from the Central Medical School in 1965, also winning numerous awards, including the Principal's Presentation for the top female student, the Glazo-Allenburgs prize for the highest grade average and the British Medical Association gold medal for academic excellence in surgery.	The following year [pr] was Fijian national champion in women's singles, women's doubles and mixed doubles.	Im darauffolgenden Jahr war sie im Einzel der Frauen, im Doppel der Frauen und im gemischten Doppel nationale Meisterin von Fidschi.
All they have to do is just support them in terms of looking for money, looking for food, and looking after the babies and the families". Milikini Failautusi (born 2 February, 1990) is an activist from Tuvalu in the areas of youth, climate change, gender, human rights, indigenous rights, and sexual reproductive health and rights.	[pr] actively works for equal participation of women in government and leadership, equal wages for women, and calling for a stop to domestic and gender based violence	Sie setzt sich aktiv für die gleichberechtigte Teilnahme der Frauen in Regierungs- und Führungspositionen und für gleiche Löhne für Frauen ein und fordert ein Ende der häuslichen und geschlechtsspezifischen Gewalt.
She studied at the Russian National Research Medical Institute in Moscow, graduating in pediatric anesthesiology. On returning to Russia, she worked at the First Moscow Hospice, after which she moved to Ukraine.	In 1986 [pr] emigrated to the US, where [pr] studied palliative care and became involved with the work of hospices.	1986 wanderte sie in die USA aus, wo sie Palliativmedizin studierte und sich mit Hospizarbeit beschäftigte.
Mamitu Gashe is an Ethiopian surgeon who is a specialist in repairing obstetric fistula, and was named by the BBC in its 100 Women list of 2018. Suffering from obstetric fistula, Gashe was brought to the Princess Tsehai Hospital that offered free surgery for the condition.	[pr] had decided to become an obstetrics surgeon after almost dying during childbirth at the age of 16 in 1962.	Sie entschied sich, Chirurgin für Geburtshilfe zu werden, als sie 1962 im Alter von 16 Jahren bei der Entbindung beinahe starb.
She attended the University of Jordan, earning a bachelor's degree in 1997 and a master's degree in 2000. For her master's degree she specialized in developmental and reproductive biology under Hameed Al Haj.	[pr] was placed in a biology program as an undergraduate due to [pr] high test scores.	Sie erhielt in ihrem grundständigen Studium wegen ihrer guten Prüfungsergebnisse einen Platz in einem Biologieprogramm.
His father owned a small estate in County Mayo. He was an active member of the Royal Irish Academy, and collected and rescued many examples of Irish traditional music.	[pr] was trained as a lawyer and became sub-commissioner of public records in Dublin Castle.	Er machte eine Ausbildung zum Anwalt und wurde Unterbeauftragter für öffentliche Aufzeichnungen im Dublin Castle.
A native of Havana, Abella received her library technician degree in 1955, a professional publicist certificate in 1957, and a PhD in 1958. She worked as a librarian at Assumption Academy until she was hired as an acquisitions librarian for the Otto G. Richter Library in 1962, specializing in Spanish and Hispanic materials.	[pr] served as the head of the circulation department for the National Library of Cuba from 1960 to 1961, at which point [pr] left the island for Miami, Florida, as a political refugee.	Sie war von 1960 bis 1961 Leiterin der Ausleiheabteilung der kubanischen Nationalbibliothek, bevor sie die Insel verließ und als politische Geflüchtete nach Miami, Florida, ging.
He also tutored in modern languages at that university. The library was named the Borchardt Library after him on his retirement.	In 1965 Borchardt was appointed foundation librarian at La Trobe University where [pr] worked until [pr] retired in 1981.	1965 wurde Borchardt zum Gründungsbibliothekar der La Trobe University ernannt, wo er bis zu seinem Ruhestand im Jahr 1981 arbeitete.
His maternal grandfather was John Chapman Andrew and his maternal grandmother was Emma Fendall. During his time studying in London, he visited the site of an early attempt to put a tunnel under the river Severn, an endeavour undertaken by his ancestor William Fendall among others.	[pr] was educated at Nelson College from 1908 to 1914, the University of London and the University of Grenoble.	Er besuchte von 1908 bis 1914 das Nelson College, außerdem die University of London und die University of Grenoble.
